,Unnamed: 0,Unnamed: 0.1,file,text,start,end,type,act,scene,sd_subtype,speaker,speaker_id,speech_number,gender,pre1_tag_type,genre,subgenre,date,pre1_base_polarity,pre1_main_emotion_class
2403,2403,2403,GerDracor/klopstock-hermanns-schlacht.xml,"Du sollst Das auch bei dem
            Schwerte schwören.",56,113,character_speech,1,14,,WERDOMAR.,#werdomar,788.0,MALE,no_annotation,S,,1769.0,no_annotation,no_annotation
2404,2404,2404,GerDracor/klopstock-hermanns-schlacht.xml,Hermann hat's geboten.,114,136,character_speech,1,14,,WERDOMAR.,#werdomar,788.0,MALE,no_annotation,S,,1769.0,no_annotation,no_annotation
2405,2405,2405,GerDracor/klopstock-hermanns-schlacht.xml,"Ja, ich hörte es wohl, wie du auf der Harfe herunter rauschtest und meiner Mutter ein
            Siegslied vorsangst.",0,118,character_speech,1,14,,DER KNABE.,#der_knabe_werdomars_sohn,789.0,MALE,no_annotation,S,,1769.0,no_annotation,no_annotation
2406,2406,2406,GerDracor/klopstock-hermanns-schlacht.xml,"Wodan, Wodan, beschließ' es auch!",0,33,character_speech,1,14,,HERMANN.,#hermann,790.0,MALE,no_annotation,S,,1769.0,no_annotation,no_annotation
2407,2407,2407,GerDracor/klopstock-hermanns-schlacht.xml,"Nun, nun, Werdomar, nun.",34,58,character_speech,1,14,,HERMANN.,#hermann,790.0,MALE,no_annotation,S,,1769.0,no_annotation,no_annotation
2408,2408,2408,GerDracor/klopstock-hermanns-schlacht.xml,"So lange die Barden singen, halten Alle das Schwert in die Höh.",0,63,stage_direction,1,14,pre_speech,,,,,no_annotation,S,,1769.0,no_annotation,no_annotation
2409,2409,2409,GerDracor/klopstock-hermanns-schlacht.xml,"
            Wodan, unbeleidigt von uns,
            Fielen sie bei deinen Altären uns an!",0,90,character_speech,1,14,,HERMANN.,#die_barden,791.0,MALE,suffering,S,,1769.0,negative,emotions of suffering and empathy
2410,2410,2410,GerDracor/klopstock-hermanns-schlacht.xml,"Wodan, unbeleidigt von uns
            Erhoben sie ihr Beil gegen dein freies Volk!",103,186,character_speech,1,14,,HERMANN.,#die_barden,791.0,MALE,suffering,S,,1769.0,negative,emotions of suffering and empathy
